|tweet|clase
4556|Café. Mucho café. RT @debri237: @Buenafuente Bns días! Como haces, para despertar con ese humor aa:)|1
4557|Buenos días! De camino a JAEN!;-)|1
4558|“@nadhia0: @David_Busta ke sería de nosotros sin tu música¿?¿?¿aa¡¡¡¡¡¡¡¡¡¡ si es ke nos das vida¡¡¡”QUE SERIA DE MI SIN VOSOTROS!;-)|1
4559|“@ROSA_SANTANDER: @David_Busta 7 DIAS y te veremos en el escenario!!! tu sitio!! CUANTO TE LO MERECES ARTISTA” GRACIAS!;-)|1
4560|Entre mis maravillosos folowercetes hay gente que juega al Padel?|1
4561|;-))) muy bueno RT @el_cuartel: Con miedo de entrar al baño tras ver ayer #ElResplandor o.O http://t.co/7l4h0kVV|1
4562|"Muy de acuerdo con @rafafdezlecter en su opinión sobre @rodrigocor7es . No así sobre ""El arbol de la vida"", jaja."|1
4563|El gobierno reduce el gasto de los ministerios en un 12,5%. CdeMinistros|1
4564|"Montoro cree q Bruselas no sancionará a España x no cumplir con el 4,4% de déficit. ""Nuestros socios valoran lo q hacemos y lo entienden""."|1
4565|Tu mas ;-)) RT @FdoFrances: @PepeDamianRS @mariviromero @naranjoisabel #FF os tenéis el cielo ganado por ser tan buenos|1
4566|UPyD reclama techos de gasto para comunidades y ayuntamientos y plan de recortes que evite asimetríashttp://t.co/zhsvZWCO|1
4567|. @javierarenas_pp comprometido con el empleo  http://t.co/4Zp8ww6G|1
4568|Buenos días...bueno mediodías!!!;)|1
4569|Un regalo para animar la mañana. http://t.co/Ji0AZqas|1
4570|Javier Arenas : comprometido con el empleo http://t.co/d4VBcue3|1
4571|En el Gran teatro de Córdoba 1  http://t.co/VM1WHqIV|1
4572|sin duda, tenéis una edad! Hahahaha bueno Mendi, mas. “@Guals: @MendiMendi1 @gonzalezpons Pues a eso es a lo que vamos a volver!”|1
4573|Yo sólo he dicho que la foto es espectacular. Ese no es mi gin tonic “@La_Coronel: @77umbriel Con poco más se hace una macedonia.”|1
4574|Impresionante el trabajo en el CERI de Sevilleja Castilla-La Mancha muy bien en la conservación del águila imperial http://t.co/Rw680boy|1
4575|Una gran historia: Revilla se reune con el etarra que le secuestró http://t.co/MG1cQVqo #ETA|1
4576|@JuanMa_Moreno ;-) tu mas ;-) tengo ganas de verte. Un beso|1
4577|Quien decía q la izq era republicana? Pedazo editorial q se marca hoy @elpais. Para q luego digan sobre asistencia a cacerías varias...|1
4578|Vamos a crear el Instituto de Crédito Público y crearemos la figura del Agente del Emprendedor para facilitar los trámites y asesorar|1
4579|"Bienvenido, Tomás. Aprovéchalo “@tarechavaleta: Desde hoy ya soy ""Orbytero"". Ya he empezado a disfrutar de este "" más"" que quiosco virtual”"|1
4580|RT: “@doctorchuslolo: seria Ras-Putin al que no consiguieron matar y consiguio el secreto de la eterna juventud. Jordi Hurtado sovietico”|1
4581|Acabamos de votar en la mesa de Delicias por q las aguas del Canal de Isabel II sean 100% de gestión publica.|1
4582|“@Miguelixto: @AlexdelaIglesia seguro?mas que Watchmen?Si no la recuerdas,esta en la sexta 3 a las 10. Te la recomiendo” bueno, admito|1
4583|¡Qué gran sueño, querido @Panchovarona! En cuanto se cumpla celebramos.|1
4584|En buenísima compañía, en A Coruña con Ayoze y Valeron!FORZA DEPOR!!!|1
4585|Buenas noches!!! Mañana Teatro Circo Price de MADRID! Fuerza para empezar la semana! Besos family!!!|1
4586|Os dejo este regalo de buenas noches... Junto a mi amigo @PabloLopezMusic http://t.co/zGlwdwfj ESPERO QUE OS GUSTE;-)|1
4587|"Fui a ver el nuevo espectaculo del Cirque du Soleil sobre la obra del genial ""Michael (cont) http://t.co/OSf16mUA"|1
4588|Buenos días. Feliz semana.|1
4589|Buenos días ;-))|1
4590|Mañana, 6 de marzo, pero de 1927, nacía el escritor colombiano Gabriel García Márquez, Nobel de Literatura|1
4591|RT @luisrull: Nunca valoraremos con justicia a los investigadores de Atapuerca. De nuevo, abriendo mundos: http://t.co/zAxi1Kdp|1
4592|"""@BBVA: BBVA Seguros lanza una campaña con Casillas e Iniesta de protagonistas: http://t.co/Yc9MZ3O2"" Gracias, @andresiniesta8 e Iker!!!"|1
4593|"Secrt. genral OCDE le dice a Rajoy que España ha dado un ""mensaje importante y un ejemplo en materia económica con clara voluntad política"""|1
4594|Apple lanza una campaña para seleccionar personal para sus nuevas tiendas en España: http://t.co/iwRW4z9O|1
4595|@Carlos_Latre El tío se deja la piel (un poco como tu ;). Lo de la cojera es increíble. Pero ya te digo que no pille el 50% de lo que decian|1
4596|"Hoy está saliendo mi nueva canción ""La Señal"" , todo es alegría !"|1
4597|Contigo seremos más fuertes: http://t.co/9zssjYiL vía @youtube Brillante spot de la AECC|1
4598|"En la exposición ""Miradas femeninas"". Muy recomendable. (@ Fundación Pons) http://t.co/09Twbdvm"|1
4599|#ElCambioAndaluz Arenas unificará la política de apoyo a las empresas andaluzas en el exterior ... http://t.co/BUGV6yhs @javierarenas_pp|1
4600|Sobran las palabras para describir el partido de ayer del R.madrid.|1
4601|Ricardo!!! Tambien ya aqui @gil_toro ;-))) como me gusta #esesamba|1
4602|Ya está la portada en Orbyt. Fijaos en lo que le decía el Campeón a su amigo mientras les grababa la Guadia Civil con orden judicial.|1
4603|A por el martes ;-)) (@ Ayuntamiento de Málaga w/ @jesusespino) [pic]: http://t.co/ulzwZ48n|1
4604|Buenos días, hoy en Sevilla firmamos el convenio de teleasistencia entre la FEMP y el Ministerio. Una medida que beneficia a miles de famili|1
4605|El empleo es el eje central de nuestro programa. Para ello hay que fortalecer el tejido productivo con empresas competitivas #forojoly|1
4606|Buenos días... Día libre! Para descansar y saborear lo vivido estos días junto a vosotr@s... #SOYFELIZ|1
4607|En el @gobierno_aragon tenemos claro el compromiso con el déficit, pero mantenido el gasto social q incluye Educación, Sanidad y Dependencia|1
4608|El prog.electoral del #gobiernodelcambio es fruto de la convocatoria abierta a la participación de la ciudadanía y la celebración de foros|1
4609|"""@Labrujulacom: Desde nuestra pequeña agencia estamos deslumbrados por tu libro, we want more!! :) thanks xxx"" URwelcome!"|1
4610|Q bueno! http://t.co/VhW4qgAJ|1
4611|Es muy fácil!“@ApoyoAlbaOjeda:Haz que ninguna familia tire sus tapones y apoye la causa Alba. 1tapon=1ilusión http://t.co/BvJ68daz”|1
4612|Pues a mi me ha encantado estar en el Homenaje a los #TesorosVivosdelaTelevivion En la UEM, con los principes http://t.co/mKoX9BiE|1
4613|José Antonio Vera, nuevo presidente de la Agencia EFE|1
4614|¡Celebra 110 años del club más grande de la historia! Celebrate 110 years of the greatest club in history! http://t.co/3kRTblwG #HalaMadrid|1
4615|"Los 2 españoles ""Jóvenes líderes mundiales"" del WEF: @EduMadina y Álvaro Fernández, CEO de SharpBrains. Felicidades!"|1
4616|¡¡¡FELICIDADES!!! RT @realmadrid Hoy felicitamos a l@s madridistas de todo el mundo porque gracias a vosotr@s cumplimos #110añosdeleyenda|1
4617|Gracias a todos por los mensajes!!!!|1
4618|Ya en @El_Intermedio !!;) q bien lo vamos a pasar!!;))|1
4619|Y aquí cierro este SuperMartes. Gracias a los amigos que hoy me han arropado. Gracias a los amigos que me arropan siempre.|1
4620|"He publicado 22 fotos en Facebook en el álbum ""Encuentro con Asociación de Mujeres Alegría de la Huerta"". http://t.co/YdPzsnoP"|1
4621|Un poco de Resacón en Las Vegas para reirme un rato y a dormir! Goodnight!|1
4622|Lo mejor del dia: @chiquicano y su foto tuenti|1
4623|Aquí va! @caroherrerabo: Si un día @juanes le hace re-tweet a uno de los tweets que le pongo creo q me muero de la felicidad!! :D”!!|1
4624|Hoy damos una buena noticia ... Vía @unicef_es .... No es habitual pero a veces ocurre...a las 9 en #losdesayunosdetve .....|1
4625|Buenos días,Hoy foto con el Fórmula1 d Fernando Alonso, y a la tarde a divertirme en @El_Hormiguero y gracias @holacom http://t.co/UAhvG8HX|1
4626|Encuentro con emprendedores y empresarios #elcambioandaluz (@ Restaurante La Peña En Antequera) http://t.co/74LcQFk8|1
4627|Muy buenos días!os deseo un maravilloso día!;-)|1
4628|Que ganas!!! RT @Davarona: @mrtfernandez Hola!! Nos vemos en iRedes, en Burgos! Bss|1
4629|Para nosotros no se entiende IU sin la tradición y protagonismo del PCE, como tampoco se entendería sin la  pluralidad y los independientes.|1
4630|Hijo, muchas gracias! “@ParradoLema: @PilarGGranja eres magnifica periodista”|1
4631|“@BernardoHM1: @BelenEstebanM. Estoy en valencia y he visto una falla tuyaa muy graciosaa!!” no lo sabia gracias me encanta valencia|1
4632|Amancio Ortega (Zara), quinta persona más rica del mundo, según Forbes.http://t.co/Nhy4LZjN|1
4633|Encantada :-) RT @lastjueves: En el Top10 de los políticos nacionales tuiteros @ccifuentes http://t.co/Lt4ng2qf q nos visitó 2 veces en 2011|1
4634|El #kukluxKat está muy activo y nervioso esta noche... :) #escolabilingüe|1
4635|Messi, Messi, Messi, Messi y Messi|1
4636|TED, la franquicia de ideas para la masa inteligente. La necesidad de volver a la dialéctica RT @TheAtlantic http://t.co/pQt69LW1|1
4637|Hoy me lo he pasado bomba en @El_Hormiguero http://t.co/krQjAlCj|1
4638|Con mi hermana con mi cuñado con mi gran amigo TURKO @tugkanke y con el amor de mi vida @RominaBelluscio .GRAN NOCHE|1
4639|Las empresarias piden más conciliación #8deMarzo http://t.co/pKs5zVIe|1
4640|RT: “@izuzquiza: Orgullo de primo: Hoy @JPelirrojo es portada de @QueDiario. ¡Gran criterio, @rafam_simancas! http://t.co/chZLXytl”|1
4641|B. Días. Messi pasa a la historia, una vez más. Cinco goles en un partido de Champions.|1
4642|Hoy en @OndaCero_es @HerreraenlaOnda ...Rajoy, Merkel, Guardiola, Messi, belén Esteban... Nos vamos a reír !!!|1
4643|Feliz día de la mujer!!! #VIVANLASMUJERES|1
4644|Gallardón, encantado de comparecer para debatir sobre el aborto, como le pedía el PSOE|1
4645|;-) RT @BelenJurado: @mariviromero Enhorabuena por la charla breve, consisa y lo mas importante: realista #mujeresenigualdad #ConOjosdeMujer|1
4646|El PP podria lograr  mayoria absoluta en Andalucía. El CIs no se moja. Le da 54-55 al PP, 44-46 al Psoe y 9-10 a IU. La absoluta está en 55.|1
4647|Desde el #gobiernodelcambio estableceremos microcréditos, avales y servicios de apoyo a las empresarias. Me comprometo con el mundo rural.|1
4648|Lucharemos contra la desigualdad salarial con un grupo de trabajo con empresarios y sindicatos que permita ir eliminando la brecha del 20%.|1
4649|Interesante reunión con el Director de Barajas para analizar el Plan de Autoprotección del Aeropuerto, ante situaciones de emergencia|1
4650|“@miguel230874: Pero mientras, ya se está aplicando, correcto?” sí y si hay cambios se incorporan.|1
4651|#8DeMarzo. Nuestro día. Felicidades a todas ;-)) http://t.co/mcSrz8bK|1
4652|Para todas las mujeres en su dia, una hermosa postal de las playas de Lisboa. Felicidades!! http://t.co/NyCT0Ubz|1
4653|"""El Gobierno respalda las palabras de Gallardón sobre el aborto"" http://t.co/fcROEJwM via @elmundoes"|1
4654|La poetisa malagueña María Victoria Atencia, candidata al sillón n de la RAE  http://t.co/9fdaZDgn via @elmundoes #malaga|1
4655|“@javiersolana: me ha encantado verte. Siento haberme tenido que ir. Nos veremos Ave, Bcna,Madrid o quien sabe Pekin o Nueva York” Un placer|1
4656|Un abrazo enorme que no nos impresionen las cifras RT @wasalcedo: con 5 millones de usuarios hay que tener suerte ... http://t.co/bldsBjyi|1
4657|Gracias a ti. RT @danielatorresgo: @AlejandroSanz  Gracias ♥ http://t.co/6Z5bhUhO|1
4658|El PP acaricia la mayoría absoluta en Andalucía. @TelediarioInter 20:30|1
4659|“Gracias a ti@AlexODogherty: @Buenafuente Fue maravillosa sorpresa encontraros allí anoche. Muchísimas gracias por la visita.Así da gusto.|1
4660|Libertad religiosa y libertad educativa, pdtes de Estrasburgo. hablamos con un experto internacional. @TelediarioInter 20:30|1
4661|Gracias a todas por hacernos mejores seres humanos.|1
4662|Vamos a por #yeswespainISDIFFERENT !!!;) jueves! Dedicado a las mujeres d la sala!!!;))|1
4663|Alguien me pasa link para ver rueda de prensa en ESPAÑOL en el Departamento de Estado @StateDept Gracias!|1
4664|Preparado para ver el partidazo entre el Man U y Athletic de Bilbao! Sera bonito seguro.|1
4665|Pero q buenos son los @LosClones de @Intereconomia !!!!|1
4666|Aurrera Athletic!! Con ese golazo de Llorente vamos a por la victoria!! Con este Manchester no tenemos ni para empezar (al descanso 1-1)|1
4667|Ilusión por #elcambioandaluz @eliasbendodo #malaga http://t.co/hZ9hFwgG|1
4668|Para que Andalucía siga en el camino seguro, para seguir avanzando en igualdad y en derechos #VotaPSOE|1
4669|Goodluck Jonathan,presidente Nigeria,confirma detención de todos los secuestradores del ciudadano británico y otro italiano, fallecidos ayer|1
4670|Hoy es viernes y los sueños brillan mas!!|1
4671|Con el maestro madrileño David Mora, al que entregué premio del @aytoSalamanca a mejor Faena de la Feria #Salamanca. http://t.co/0LuYjjrm|1
4672|“@LucaCulinquieta: Boris Vian convertía la luz en perlas de color. Gabilondo @EDCHrne convierte las palabras en perlas de sonido|1
4673|Francia confía en España, que está haciendo «un gran trabajo» http://t.co/vfLxBPCH|1
4674|Comisiones Obreras aprueba por unanimidad la convocatoria de huelga general contra la reforma laboral para el 29 de marzo|1
4675|Pido #votaPP para un proyecto moderado que cree en la libertad. Ofrezco el aval de la creación de 5M de empleos en España y 1M en #Andalucía|1
4676|RT @jordiGlez: Coca-Cola y Pepsi cambian la receta para evitar una 'etiqueta de cáncer' http://t.co/LMYUwry3 vía @elmundosalud|1
4677|Hoy hemos firmado un convenio con el Ayuntamiento y la Diputación de Granada para dar Teleasistencia a mas de 9000 mayores granadinos.|1
4678|A las 3 en @A3noticias, el consejo de ministros aprueba la dación en pago, con condiciones. Os explicaremos cuáles son esas condiciones|1
4679|@mgilguerrero @JoelaReina Míralos aquí, son la leche, a mi me encantan:http://t.co/DyDB7YpU|1
4680|De San Sebastián tenían que ser, Fede, de San Sebastián... @FedericoQuevedo @joelareina|1
4681|Hoy se ha aprobado una pseudo dación en pago. ¿Guiño al 15M? Hemos hablado con familas a punto de deshaucio. @TelediarioInter 20:30|1
4682|Comenzamos ;-)) #elcambioandaluz     #malaga http://t.co/byayRbyU|1
4683|Listos para arrancar!!!! @telediariointer 20:30 con @LosadaPescador @icacabelos http://t.co/eCzEqBJW|1
4684|Con mujeres de la Asoc de Nigerianos de #Malaga que han venido al mitin ;-)) http://t.co/UABrZpx8|1
4685|Los miles #proveedores d CLM a los q los socialistas dejaron entrampados hasta l cejas podrán cobrar  gracias a @mdcospedal y @marianorajoy|1
4686|GRACIAS SANTANDER!!! hoy ha sido uno de los días mas emocionantes de mi vida!!! Volveremos en verano! Os espero en la BALLENA!!!|1
4687|Pues yo pienso trabajar el día de la huelga.Porque tengo todo el derecho. #ahílodejo #HuelgaGeneral #29MhuelgaGeneral #29M A buenas horas...|1
4688|Esto es el top ten de onda melodía de hace cincuenta años, x lo menos!!!|1
4689|Por fin he vsto La Piel que Habito. No tengo palabras.|1
4690|Bdías. Hoy hace un año que escribí mi primer tuit. 89.998 gracias. Vuestra influencia me ha ayudado mucho a dirigir EM e impulsar Orbyt|1
4691|Lanzarse a las calles con las botas de macarra... Gran sábado.|1
4692|Acabo de recibir ejemplares d mi nuevo libro q sale en una semana. Que os guste! http://t.co/sY4YmPxs|1
4693|Me encanta esta foto de la portada  de @diario_sur   @esperanzaona , @eliasbendodo , @javierarenas_pp y @marianorajoy http://t.co/TfDxYSP3|1
4694|Me dice la editorial que si. RT @rachelphaba: @sevillajordi va a salir en electrónico?|1
4695|Qué gran coincidencia llegar a 90.000 el día que cumplo un año en Twitter. Y qué gran coincidencia que lancemos mañana una superpromoción.|1
4696|En Almería, acto a las 12h en la Rambla con Diego Valderas y Rosalía Martin. IU sigue generando confianza, cada día más. #25M #rebelate|1
4697|Arzak... Nunca he flipado tanto como con aquella doble página. #ganasdellorar|1
4698|. @Marianorajoy dice que con @JavierArenas_pp  acabará 'el manejo injusto del dinero' en la Junta http://t.co/Pqfd4szC|1
4699|Que partidazo del Bilbao contra el United. Felicidades.. ;)|1
4700|“@FotogramasVOD: Interesantísimas conclusiones extraídas de los 100 primeros días de vida de Canal+ Yomvi: http://t.co/z04S6AV1” ojo al dato|1
4701|Vamos a por la primera d la tarde d #yeswespainISDIFFERENT !!!;) cogemos aire y...|1
4702|Hasta luego! BESOS!!!|1
4703|Más majos. Aqui, charlando de cine http://t.co/7YNirPOL|1
4704|@javierarenas_pp y el @ppandaluz se comprometen con Cádiz y su Sierra a desdoblar la conexión Arcos-Antequera. #votaPP #votaJavierArenas.|1
4705|A pesar del buen partido del Betis contra el Madrid, de momento 2-3.|1
4706|Os dejo una fotito mía en el túnel de vestuarios antes del partido. Como me gusta estar en mi tierra!! Hoy ha sido de  nuevo un gran día.|1
4707|Solidaridad y recuerdo con Japon@Lagarde津波と地震の発生から1年を迎えるにあたり、日本の友人たちに思いを馳せずにはいられません。日本の皆様、心から応援しています。|1
4708|La cultura del esfuerzo personal hay q enseñarla, estimularla y premiarla/retribuirla. Pero no confundirla con la sobreexplotación.|1
4709|Mi primer recuerdo y mi homenaje hoy a las víctimas de los atentados del 11M. RbCb|1
4710|Qué gran día hace en Barcelona! Ahora toca un buen entreno y después ver a mi equipo jugar en Santander!|1
4711|A las 12:00h estaré en el parque del Retiro, en el homenaje a las víctimas del #11M organizado por la @_AVT_  #11Mconlasvictimas|1
4712|RT @nnggAsturias: @NNGGMIERES: #MercedesFernandez no pidió estar,el partido selo pidió a ella y aquí está.Es una mujer valiente.@mdcospedal|1
4713|El tema del CHARE de Vejer es muy serio no solo por no estar abierto, sino x la deuda q la Junta mantiene con la E. adjudicataria desde 2011|1
4714|Sabe alguien a qué hora juega el Barcelona? Gracias|1
4715|es verdad, pero seguro q Carlos lo discute tb... ;) “@perodeque: @TrasgodeGaceta @PilarGGranja En auswitch tampoco lo habia.”|1
4716|Estoy cursando un Master avanzado como comprador de segunda mano... Q armario zapatero por 35€ me he comprao!|1
4717|Que bonitas :-) RT @alvarosantos71: Gran homenaje a las víctimas del 11-M . Estas son algunas de mis fotos. http://t.co/WfwSeIS4|1
4718|Volviendo a casa muy contento después de la victoria contra el Racing y por las sensaciones del partido! Un... http://t.co/6a6Eh4gR|1
4719|Muy bueno Reixa: la fabricación de placas inaugurales en la época de don Manuel, una industria boyante #cuandoeramoscultos|1
4720|Gracias #VisitaElHierro RT @sanzchile: @AlejandroSanz Para los que no sabíamos mucho sobre la isla http://t.co/aUKiQsUe|1
4721|Huauchinango! Gracias x hacerme sentir tan querida 15.001 almas cantando juntas debajo d la lluvia!!!!! Conciertazo!!|1
4722|Buenos días ;-)) #lunes|1
4723|Buenos días foloweros!!!;)) happy monday!!!;)|1
4724|Asi es ;-) RT @DesireedeSosa: @mariviromero con este día... Da igual que sea lunes o sábado! Hay que aprovecharlo a tope!|1
4725|Con esta visita relámpago queremos participar en la estrategia mundial contra la droga.Proponiendo y participando n los planesinternacionale|1
4726|Qué buena manera d empezar la semana con este bello libro regalo de 3 estudiantes de periodismo...grande Szymborska!!! http://t.co/GWk7oX9c|1
4727|Quiero ser un alcalde para #Andalucía. Un alcalde es quien convierte cualquier problema de un ciudadano en un problema propio. #votaPP|1
4728|@julia_otero mientras más detalles conocemos, más se desinfla el gran anuncio! Será otro hábil logro de comunicación del PP?|1
4729|Pido #votaPP porque con el pasado no se conquista el futuro. Seremos un gobierno vanguardista que siempre utilizará el diálogo. #Andalucía|1
4730|#VisitaElHierro RT @el_conejoblanco: @AlejandroSanz lanza #VisitaElHierro a 'Trending Topic' en España: http://t.co/eEwerDVu|1
4731|siguiendo a @despensamalaga ;-)) me gusta|1
4732|No lo dudes, Unico. RT @Mary26_Esencia: @AlejandroSanz #VisitaElHierro no me cabe duda que debe ser un lugar hermoso|1
4733|Os dejo. Tengo a mi tocayo Syntec por aqui de paseo. Jeje. Y hoy viene el presidente de Universal de Brazil a ... http://t.co/VXG1rggY|1
4734|Sevilla acogerá al menos un partido de los que se celebrarán en el Mundial de Balonmano en el pabellón de San Pablo. Enero 2013 #sevillahoy|1
4735|Opel ha sido, es y será empresa estratégica para #Aragón. El éxito d esta planta contribuirá en gran medida al éxito d la Comunidad Autónoma|1
4736|Podréis ver a Suite el 4 de abril en Mallorca en el festival Spring Meeting!!! Buenas noches.|1
4737|Primero, conseguirme la partitura. Luego, premio|1
4738|Asi tuitea RT @Fran_Vazquez_: @mariviromero @FrediLg @Pepegrinan Jajajajajajaja... muy bueno,Mariví :-) Y pone la arroba con el ombligo!!|1
4739|Totalmente RT @eliasbendodo: Y el ganador del debate es..................@javierarenas_pp  Pensadlo bien.|1
4740|@mjguemes @raquelmartos Y besos!|1
4741|@FedericoQuevedo Gracias!!!! Mil besos|1
4742|Prof Sagardoy ha contado q en NovaCaixa Galicia, hasta 4.000 empleados han modif condiciones d trabajo para evitar paro. Algunos hasta 75%.|1
4743|@PalomaCervilla Bueno, quizá contaban con ello. Del 4,4% al 5,3%. Sobre el 5,8 son 5.000 millones más|1
4744|Muy intrigada y cn muchas ganas de escuchar lo nuevo d @AfrikaFuentes feat. @Miguel_Campello. Aquí el teaser d Rainbow http://t.co/BQcTgBsP|1
4745|He encontrado estas grandes obras de arte... http://t.co/Vk4tuqGf|1
4746|@rafam_simancas @quediario Gracias!!!! a vosotros.....|1
4747|El precio de la vivienda cae un 9,5%.Con este dato,mes de febrero,el descenso desde 2007 se sitúa en un 27,1% y retrocede a la media de 2004|1
4748|"""El gob Irene no va asee pasivo con el déficit tarifario. Tengo un mandato del Pte del Gobierno. Es lo q haré"". @jmsoria #ICSORIA"|1
4749|Cataluña asegura que da 16.000mill +de lo que recibe  http://t.co/8rPfQRMM pero otros informes dicen q Madrid la dobla http://t.co/BMDWjmfU|1
4750|Gracias a vosotros y enhorabuena ;-) RT @AERTECsolutions: @mariviromero @josepoyato @diario_sur Muchas gracias por compartir la entrevista|1
4751|"""haremos políticas de inversión de promoción de nuestra capacidad turísticas: en Europa y en economías emergentes como Rusia"" #ICSORIA"|1
4752|Me gusta esta foto ;-)) @eliasbendodo @javierarenas_pp #elcambioandaluz http://t.co/IJqNf8kv|1
4753|Hoy viajaremos a SALAMANCA!! Mañana presentamos el #yeswespainISDIFFERENT d los días 13 y14 d abril!!;)) bien!!!;)))|1
4754|"""@moreenaOyeChico: Risto tío enorahuena has sido el primer hombre que pasa de mi culo! gracias"" Sorry, no me gustan los lugares comunes."|1
4755|Instituciones Penitenciarias zanja que fue el anterior Gobierno el que impulso la libertad condicional del etarra De Luis Astarloa|1
4756|Telemadrid @FrikisAnonimos: #yonuncahe @Buenafuente ahora unas risas no irian mal, un chiste rapidoaaaa”|1
4757|El PP propone crear una subcomisión sobre la transparencia de productos financieros e hipotecarios: que la letra pequeña no lo sea tanto|1
4758|"Alonso, PP, ""el Gobierno no tiene intención de despedir empleados públicos pero va a eliminar duplicidades"" #congreso"|1
4759|;) RT @dj_minage24: @AlejandroSanz  yo tambien apoyo tu tweet #VisitaElHierro|1
4760|Vamos. ;) RT @sintiendosanz: @alejandrosanz ale veeeeennnnnn vamos a las TARDES SANZERAS CON @FERRSANZOFICIAL http://t.co/EE6KHvuz p|1
4761|Ole .. Un abrazo RT @ANTONIOMEJIASP: @AlejandroSanz @gaby_MASBSAS EL CALOR DEL PUEBLICO, EL PODER SACAR ESE OLE A ... http://t.co/rnZ8nG8Y|1
4762|Sigan a @MpazMadrid por favor  RT @FanClubMASes: @AlejandroSanz sabes que Mensajeros de la Paz a abierto un ... http://t.co/KeKxq2eE|1
4763|Preciosa foto de @eliasbendodo ;-)) http://t.co/81TlKMhH|1
4764|Montoro asegura que el ajuste adicional correrá a cargo del Estado. @TelediarioInter 20:30|1
4765|Ahora si lo puedo confirmar ! El 26 de Marzo estrenamos @A3NumeroUno|1
4766|Ya somos dos ;-) RT @GanasdeVivir: Tras un día precioso #GanasdeReflexionar !!!|1
4767|"""El cuaderno de Maya"" me tiene enganchaíta. Primer libro que leo de Isabel Allende y me gusta mucho"|1
4768|Buenas noches! Y dulces sueños...|1
4769|Buenas noches a todos, ojalá llueva pronto.|1
4770|Caballeros : vamos a rodar con  @josecorbacho y @Berto_Romero .... Todo por la risa....|1
4771|Enhirabuena RT @borissoler: A las 12h. presentamos #HairAcademy  #FuertesyHermosas ojala hubiese mas personas como tu http://t.co/ja9SVWQq|1
4772|Dice Alfonso Alonso, portavoz del PP en el Congreso, que en 80 días de Gobierno se han emprendido más reformas que en 8 años|1
4773|En España se constituyeron 7.951 empresas en enero, un 11,6% más que en el mismo mes del año anterior. Una buena noticia. @que_hacen|1
4774|En su nuevo estilo, Rajoy llega a comprender, no a disculpar, a Zapatero aunque solo sea sobre lo largo que es contestar a todos los grupos.|1
4775|"""Yo no soy la opinión pública ni la opinión publicada. Soy sólo el Presidente del Gobierno"". Genial @marianorajoy"|1
4776|Muchas gracias por seguirme y enhorabuena por la Tele @101TvMalaga  ;-))|1
4777|Camino de Almonte: tierra de rocieros, gente trabajadora y un parque natural único en Europa. Qué belleza la de nuestra #Andalucía!|1
4778|Que orgullo que la previa del @realmadrid la presente @mateogarciab. Enorme periodista y buenisima persona #soyfan http://t.co/XK8PaoCg|1
4779|El anuncio de Loewe ha despertado la polémica. Hemos salido a la calle. Muy divertido. @TelediarioInter 20:30|1
4780|;) RT @Yaneth1: Felicidades a @OscarCruzVM y a @Aleorozcoficial vi la Public d sus CD`s y me Emocione Chingones!! ... http://t.co/ZoGH3jsK|1
4781|De retirada, que mañana hay que despertar a unos cuantos. Mil gracias a la gente de #40AniversarioCcinf por el regalo de estar allí. ANIMO!!|1
