|tweet|clase
1474|"Esperanza Aguirre marzo 2010 llama a ""rebelión"" por subida IVA: ""Cero patatero Zapatero"". ¿Dirá ahora: ""Rajoy hoy estoy que te doy""?"|0
1475|"Claro,claro..... sobretodo ahora que no tengo programa. ""admirador""RT @RG_16: @Buenafuente como admirador te digo que te has vendido"|0
1476|Pero alguien pensaba q no nos iba a tocar pagar los desaguisados de éstos que hemos echado? La cosa no ha hecho más que empezar. #2012duro|0
1477|Los funcionarios, además de tener congelado el sueldo, tendrán que trabajar dos horas y media más. O sea, en la práctica, recorte salarial.|0
1478|Subidas de impuestos,recortes y ni palabra de eliminar Diputaciones,duplicidades,fundaciones y sociedades públicas,fusionar ayuntamientos..|0
1479|Sorprendente. En Menáme han decidido que mi último artículo está duplicado y lo han cerrado. http://t.co/ciQl5rsX|0
1480|La primera en la nómina (Rajoy sube impuestos y recorta gastos) y acusación del fiscal contra #Urdangarinhttp://t.co/X6dXKB7W#portadaEPC|0
1481|Rajoy rectifica en horas un ataque directo al Estatuto de Andalucía. (Se adivina el susto de Javier Arenas): http://t.co/dh1xkeaI|0
1482|Las hemerotecas/videotecas/fonotecas perseguirán sin piedad a todos los que defendieron la bajada de impuestos con gan profusión de razones.|0
1483|Lo que han aprendido de vsotros los del Pp estos siete años eh? Y ahora a probar de la propia medicina,qué rica! @iescolar|0
1484|Eso:“@Sindy_ro: @ccifuentes Que el gobierno condecore a Zp me parece humillante cuando deberían sentarlo en el banquillo por hundir España.”|0
1485|En España se mueven unos 56.000 mill€ en billetes de 500. De la mayoría, en negro, no pagan impuestos.|0
1486|“@mikelayestaran: @anapastor_tve un alto mando irani niega el lanzamiento d misiles hoy segun @RT_com ¿entonces las imágenes, d archivo?”|0
1487|La izquierda debe superar la resignación y la renuncia, pero también los dogmas, las sectas y las capillas irreconciliables.|0
1488|El gobierno reconoce q regresamos a fiscalidad felipista, según me cuentan fuentes del ejecutivo. Q bien!|0
1489|Ahora resulta que la culpa de la dramatica situacion economica y de los recortes es de @MarianoRajoy... Flaca memoria! #HerenciaPSOE|0
1490|Con #rajoynazo1 menos consumo, producción y actividad y más paro. Riesgo de 5 millones paro registrado y 5,5 EPA en pocos meses|0
1491|¿A que el rey Juan Carlos no llama al presidente alemán para pedirle la cabeza de Merkel? #diferencialconAlemania http://t.co/Bs6gCTT4|0
1492|O sea, q cambia quién está en el Gobierno y quién en la oposición, pero NO CAMBIA la manera d hacer política: confrontación y tú mas! Malo.|0
1493|"Dejadme decirlo 1vez:me sorprende tanto ""sabio económico"" q plagia mis análisis y propuestas unos meses después d criticarlos o ignorarlos."|0
1494|La demanda de energía eléctrica cierra el año 2011 con caída. Indicador claro d recesión. Lo siento.|0
1495|@AlexdelaIglesia recuerda a Sinatra; lo siento por las personas que no beben al levantarse por la mañana, no van a mejorar según pasa el día|0
1496|Descaro total: #Urdangarín negoció contratos con dirigentes del Gobierno balear en el Palacio de Marivent http://t.co/5TBl4xqQ|0
1497|Haz lo que digo y no lo que hago, yo puedo hacerlo y tu no, mi titulo vale más q el tuyo, no compares, ninis... Doble moral: Os suena?|0
1498|"RT @lavozlibre_feed: Sanz critica el ""cinismo"" del PSOE-A y lo califica como el ""rey de los recortes"" http://t.co/zT0evQSQ"|0
1499|@Juandecolmenero @carlosecue 5 líneas antes escribe Carlos que se hacen los sorprendidos pero que hace meses que hablaban del 8%.|0
1500|diariosur.es: Solo dos de cada diez arquitectos viven exclusivamente de la profesión http://t.co/b8pRjTqR|0
1501|«Venir al Ministerio del Interior no es tener un cargo, sino asumir una carga» - ABC.es http://t.co/lrdL3PMC via @abc_es|0
1502|Salgado mintió: se comprometió a que cerraríamos el 2011 con 6%; Rajoy mintió: se comprometió a no subir impuestos. @TelediarioInter 20:30|0
1503|"La trastienda del PP valenciano: ""Las miradas de los populares valencianos se clavan en Fabra: ¿para que nos sirve?"" http://t.co/m0ujeyHi"|0
1504|Tres ministros de Rajoy dan tres cifras o estimaciones del objetivo de déficit sobre el 8% en un día: Guindos, Montoro y Fernández.|0
1505|Para los mercados se trata de cambiar de caballo ( Presidente) aunque sea a mitad del río. Para nosotros se trata de cambiar de dirección.|0
1506|El lío con las cifras de déficit (Guindos, Montero y hasta J. Fernández) perjudica al gobierno. Debe hablar uno y la cifra debe ser sólo una|0
1507|“Un ajuste como el aprobado por el Gobierno va a hacer que la economía se pare más” Rubalcaba en @La_SER|0
1508|Las reformas de las leyes penales no las anticipa el ministro de Justicia sino el de Interior que también corrige el déficit al de Hacienda|0
1509|El modus operandi seguido en la Consejería Empleo en el caso ERE podría haberse adoptado también en otras consejerías http://t.co/Bxq8aYOw|0
1510|“@jotapecarrion: @javiersolana ¿y es realmente un golpe de estado?”A El Consejo de Europa no le gusta.|0
1511|Estoy indignada con la subida de impuestos. Han mentido. Q recorten el gasto publico. #asino Todos sabíamos déficit 8,3%. Y la coherencia?|0
1512|el modelo actual d medios perjudica a periodismo y a libertad d prensa x depender l mayoría dl control,subvención o licencia d ls gobiernos|0
1513|Y eso es nada... Uff “@nachoramos: Por cada Medio de Comunicacion que cerró en 2011 cerraron más de 4.000 autónomos.”|0
1514|Ha marcado el @realmadrid no? ;-(((((|0
1515|Tristeza.|0
1516|Andalucía cierra el año 2011 con 969.152 personas en paro http://t.co/xUQvUWS9 via @elmundoes|0
1517|. @javierarenas_pp  dice que la sociedad acepta más impuestos harta de mentiras http://t.co/WdL39kwn|0
1518|La subida del IRPF de Rajoy vulnera la doctrina del Constitucional http://t.co/g6sdBhCW via @el_pais|0
1519|"De los autores ""Mira cómo brilla este suelo"", llega ""Se van a desnucar tós"", (en los mejores aeropuertos de España, en especial en Málaga)."|0
1520|Mi sentido pesame a la familia y amigos de Enrique de Melchor, un gran guitarrista que pierde el flamenco.|0
1521|Los cvientíficos se quejan de los recortes, pero el despilfarro es total. Os lo contamos en el Top secret. @TelediarioInter 20:30|0
1522|Vamos, que Chacón contraprograma el acto de las medidas de Rubalcaba a las ocho de la tarde. Detalle navideño para las redacciones :)|0
1523|La petición de la carta del BCE se la repetí, después de Zapatero, a Rajoy al día siguiente de ser investido y antes del nuevo gobierno,|0
1524|#cartaalosreyesmagos. Rajoy necesita una sala de prensa. La q hay no le debe de gustar|0
1525|"Y hoy en día qué es fiable?RT “@Hugovalladolid: La prima de riesgo no es fiable. Ya no debería ser información. Solo nos compara..."""|0
1526|Y a mi también “@chefidiaz: Me da vergüenza leer ésto http://t.co/uUfsEpBW”|0
1527|Esto es precisamente lo que se pretendía evitar. 'La prima de riesgo continúa su escalada y alcanza los 370 puntos' http://t.co/9slbRFwe|0
1528|Espermos que el ministro de Defensa no acuda a la videoconferencia con guión como su predecesora.|0
1529|Rajoy comparecerá en el Congreso para explicar los recortes tras el Consejo Europeo - ABC.es http://t.co/XZ5OgCQe via @abc_es|0
1530|El objetivo de cierre de empresas públicas de las CCAA es el fijado en el 2010. ¿Ambición? @TelediarioInter 20:30|0
1531|Elvira Rodriguez nos acompañará para hablar sobre el recorte a las CCAA y la supervisión de sus presupuestos. @TelediarioInter 20:30|0
1532|Riolobos cree que Barreda deberia estar entre rejas por su gestion en CastillaLa Mancha http://t.co/dyQcynFW vía @eldigitalcastillalamancha|0
1533|La comparación de la Sra. Sáez d Sta. María del déficit de la SS entre 1996 y hoy es un insulto a la inteligencia: Obvia  fondo 65.000mill€|0
1534|Ibarra presenta una enmienda según la cual Rubalcaba y Vara tendrían que dimitir como diputados / PSOE http://t.co/8ZZPyqFU via @europapres|0
1535|Los recortes y recargos deprimen la economía. Álvarez Cascos y Gabino de Lorenzo agitarán  Asturias. Crisis sobre crisis.|0
1536|La #HerenciaPSOE ha dejado un de´ficit del 8%, ocultando el grave deterioro de las cuentas pu´blicas (erro´neo diagno´stico y mala gestio´n)|0
1537|Me confirma @mariolacubells que la gala se firmó aún mandando el Psoe. Pues de saberse hubieran perdido aún por más.|0
1538|El futuro nos tortura y el pasado nos encadena. He ahi porque se nos escapa el presente. Flaubert|0
1539|Dos tipos de 10 años me humillan y desnudan mi analfabetismo cibernético Ahora el roscón con chocolate quiebra mi disciplina. Reyes|0
1540|"@Fgarea Me autocito: ""Extraña forma de entender el liderazgo, tan parecida a una monja de clausura"""|0
1541|Empresas publicas y comunidades autónomas. Como derrochar, como ocultar el déficit... Y Valencia,como siempre... http://t.co/479XB1Kq|0
1542|Sobre Ivonne Malleza. Encarcelada hace unos días en Cuba. http://t.co/6NaEG1oq|0
1543|Ejem... +1 RT @redliberal: Suscripciones institucionales a diarios en 2011: ¿quién se benefició más? http://t.co/NU1e662Y|0
1544|Las redundancias administrativas nos cuestan 32.000 euros. Urge su reforma|0
1545|RT @elviswarrior: Con el carro de Manolo Escobar? “@mariviromero: ¿Dónde fue a parar el dinero de los ERE? http://t.co/EVVHuRw0 - http:/ ...|0
1546|".@Javierarenas_pp "" los socialistas en Andalucía  se han cargado la FAMP porque no iban a gobernarla ellos"" http://t.co/5ETbr4G7"|0
1547|Madame Barroso y sus amiguetes,ls Roures y Cía creen que esto de gobernar un país es una coña de las suyas,una cosa para wyomings...|0
1548|Miedo en Gobierno y Rajoy de q próxima semana mercados ataquen deuda española y desbaraten dl todo el discurso d q el problema era ZP|0
1549|No existe más pensión vitalicia que la de expresidente del gobierno, el resto como los demás.|0
1550|Primera encuesta sobre los recortes de Rajoy y la batalla entre Rubalcaba y Chacon, de Metroscopia, mañana el EL PAIS.|0
1551|A veces, la lógica interna d los partidos, les lleva a elegir un líder q difícilmente podrá ganar elecciones. Por ej: republicanos USA.|0
1552|Q valientes..Paramilitares cubanos org actos d repudio contra una dama d blanco en huelga d hambre lanzandole piedras http://t.co/QyR5y0Td|0
1553|Expresos del franquismo forman 'La Comuna' para exigir justicia. Por @Diego_Barcala. http://t.co/5OhElBh3 #porquePúblicohacefalta|0
1554|"Gara p.10: ""Los presos provocan una expresión de cariño que desborda el relato oficial"". Adorables asesinos. Euskadi, enfermedad moral."|0
1555|Decreto del AJUSTE y el RECARGO temporal, pero sobre todo del RIGOR MOTIS de la economía, el PARO y la AUSENCIA  del nuevo presidente Rajoy.|0
1556|La lista de la compra del palacete de Jaume Matas: Ocho televisores Bang & Olufsen, 40.000 euros  http://t.co/U9PIHRHH|0
1557|I favorited a @YouTube video http://t.co/OLAE3DUh Los recortes sociales del PSOE en Andaluc|0
1558|Esta es la realidad...Los recortes sociales del PSOE en Andalucía  http://t.co/8oY6XSpp|0
1559|Hoy en @hora25 la historia de esos jóvenes que se independizaron y a los que la crisis ha obligado a volver a casa|0
1560|#BastaYA . 4 en 9 dias . Hallado el cadáver de una mujer con signos de violencia en Fuengirola http://t.co/dGRfmT3T|0
1561|Los jueces valencianos, a la cabeza en carga de trabajo... http://t.co/y5Vaz3AN|0
1562|. @EliasBendodo  asegura que la Diputación ha generado un impacto económico...: http://t.co/in7Jnedq vía @malagahoy_es|0
1563|Muere el presidente de Guinea-Bissau, Malam Bacai Sanhá http://t.co/yKViER0H (EP)|0
1564|"Conviene recordar que en el año 2009, cuando subir impuestos era ""un atentado"", el déficit era del 11%. Hoy está al 8% http://t.co/eR8q2o0J"|0
1565|3.500 anuncios, 7.000 defraudadores, cm mínimo. Es l política d vivienda d l Generalitat y el control dl fraude dl Gob? http://t.co/BDPapwv2|0
1566|@iescolar Y con la escobilla no se pondría mandar a la mierda el coloso castellonense? Es por darle utilidad...|0
1567|También hablaremos en @TDtarde @13television de la corrupción que se sienta en el banquillo.|0
1568|"Esa es justo la palabra...Sanz critica el ""cinismo"" del PSOE-A y lo califica como el ""rey de los recortes"" http://t.co/CgbqtR32"|0
1569|Alucino. Grecia incluye a los pedófilos en su lista de personas con discapacidad con derecho a paga. http://t.co/HG3AnneB via @AP|0
1570|Los recortes sociales del Psoe en Andalucía. En mi blog  http://t.co/qipdWuGr|0
1571|¿Crisis? ¿Para quien?bit.ly/xAEdm7|0
1572|bit.ly/xAEdm7¿Crisis? bit.ly/xAEdm7|0
1573|Al menos 20 muertos y 25 heridos por la explosión de una bomba en una gasolinera en Pakistán, en la zona fronteriza con Afganistán|0
1574|Lamentablemente en Cataluña se prioriza la construcción nacional y las políticas identitarias sobre salud,educación o recuperación económica|0
1575|Twitter me propone que siga a Guindos pero esa cuenta es un fake manejado con habilidad. Al suplantador le debería caer una buena multa.|0
1576|El déficit del 8% es la muestra de la austeridad hipócrita del PP, pero sobre todo del fracaso del ajuste que provoca recesión, paro y deuda|0
1577|@mgilguerrero sorprende que preocupe más un posible relevo en Tráfico que el terrorismo. Alucinante con las preguntas. ¿El nuevo periodismo?|0
1578|Las cifras de Rajoy: 15.000 millones autonómicos + 3.000 del Gobierno + 1.500 municipales + 5.000 de la SS. Suman 24.500 millones, no 20.000|0
1579|ERC&PP no han apoyado ese pleno monográfico sobre impulso d l economia y efectos d ls recortes que registramos mañana.El govern no lo quería|0
1580|"Mañana en @elconfidencial mi #dos palabras ""Cuando la corrupción se convierte en nuestro peor enemigo""."|0
1581|Como s genera nuestro déficit:15.000 millones las com autónomas.5000 mill seg social.3000 mill Estado.1500 mill ayuntam http://t.co/wIw3IXeC|0
1582|Mañana hay pleno en el Congreso de Diputados para convalidar el decreto de recortes del Gobierno. Nos dan 10 minutos para fijar posición.|0
1583|Noooooooooooooooooooooooooooo|0
1584|Me quedé corto: recorte d déficit no será d 30.000m sino mucho más. Pues sigue sin salirme el cómo lo harán con lo q falta q es muuucho.|0
1585|Al menos 1muerto y 2heridos x la explosión d una bomba adosada a un coche en una plaza del norte de Teherán,cerca d la Universidad (PressTv)|0
1586|Me he dado cuenta de que cuesta mas levantarse de la cama cuanto mas frío hace fuera...#perogrullo|0
1587|Cuando la corrupción se convierte en nuestro peor enemigo - Dos Palabras http://t.co/mw8jkzmG vía @elconfidencial|0
1588|"Uuuuuuuys! Montoro pide a la Cámara que ""dejemos de lado la ideología"" ante la crisis... Danger"|0
1589|El PSOE pide q se haga lo que el no hizo en dos legislaturas..Y da lecciones de gobierno en las CCAA mientras la Cámara le espeta:Andalucía!|0
1590|Empieza la degradación del debate, con la herencia recibida y el ' y tu más'. Montoro dice que el PSOE conocía el déficit.|0
1591|"Montoro dice que pide ""un esfuerzo pequeño de muchos"" con la subida de impuestos. Y defiende los impuestos ""a la propiedad"". Ver para creer"|0
1592|Montoro clama ahora x una política de luces largas...y sigue con el rafa rafa de la pinderacion|0
1593|"Montoro, hace dos meses: ""Si subiéramos el IRPF tendríamos menos crecimiento y más paro, con eso se lo digo todo"" http://t.co/Zjk7ofA8"|0
1594|Cuando Montoro decía estas cosas ya sabía que el déficit era del 8%. Él mismo lo iba contando. http://t.co/Zjk7ofA8|0
1595|El debate sobre déficit publico es el viejo debate sobre cañones o mantequilla.|0
1596|En el AVE con @JoseMotatv para ir a Barna. #palizon #señorasmayoresdegira #abuelas #desmadreenelgeriatrico|0
1597|No se puede utilizar la crisis como excusa para privatizar servicios públicos. Atacar a lo público es atacar a la democracia.|0
1598|Se han ampliado 100.000 millones para avales a la banca. La banca siempre gana y altos directivos más.|0
1599|La Junta de Andalucía sigue echando mano de la chequera para amigos. Se lo contamos en nuestro top secret. @TelediarioInter 20:30|0
1600|Alonso dice que en Andalucía no hay corrupción. Risas en el hemiciclo. @TelediarioInter 20:30|0
1601|que clamores? De Obama? “@EFEnoticias: EEUU recuerda diez años de Guantánamo entre clamores para su cierre inmediato #Guantánamo #EEUU”|0
1602|Hubo un tiempo en que la capacidad profesional, el valor y la admiración no se medían por la Cuenta Corriente.|0
1603|Los abogados repudian los #CIE para extranjeros, el sí de CiU a Rajoy y el desafío de Chacón a Rubalcaba.http://t.co/kAzDRh8y#portadaEPC|0
1604|Rajoy&Duran apoyan subida d impuestos a todos ls españoles,justo lo contrario d lo que dijeron hace 2 meses antes dl #20N. #pepevergencia|0
1605|La adicción a Internet se caracteriza por una integración anormal de la materia blanca http://t.co/F6CN8vim|0
1606|"Mas!El ex alcalde de Los Barrios y la delegada de Cultura de la Junta, imputados por delito urbanístico"" http://t.co/ywIPSbAs via @elmundoes"|0
1607|A las 3 en @A3noticias, según Defensa, piratas somalíes atacan un buque de guerra español.  Un pirata muerto, y varios heridos|0
1608|Y preguntamos en @13tv_AlDia : ¿engañó @marianorajoy a los votantes (impuestos) o engañó el @PSOE a los españoles (déficit)? @DHAM_13tv|0
1609|Ana Botella traiciona a los madrileños al abandonar la reivindicación de una mejor financiación municipal. #Madrid http://t.co/Kh12Tcg4|0
1610|Adiós al maestro de humanidad: http://t.co/A37enFkr vía @diariodejerez|0
1611|El soldado Bradley Manning se enfrentará al consejo de guerra  http://t.co/Uh2Y5tgv via @el_pais|0
1612|"Toma! compravotos“@AdrianaRey83: Portada mañana @gaceta_es ""Griñán regaló 54 millones a UGT y CCOO el mismo día en q convocó las elecciones"""|0
1613|“@TelediarioInter: Top Secret: El #PSOE de Andalucía despilfarra otros 90 millones de euros en subvenciones. http://t.co/aiWHNXRJ”|0
1614|Indigna que Gobiernos UE no exijan cambio estatuto BCE para prestar directamente a Estados. Paro disparado y casino financiero a tope.|0
1615|Rajoy pide ayuda a la UE. ¿Para los españoles? ¿Para evitar los recortes? No. Para la banca http://t.co/7t8oRLse|0
1616|Pero estamos convencidos d q @ToniCanto1 no querrá contribuir a ningún expolio y devolverá 130.000 euros al contribuyente valenciano. Seguro|0
1617|La sentencia del caso Marta del Castillo es una VERGÜENZA #INDIGNADOSporsenteciaMarta|0
1618|"La parte en la que rechaza condenar por ""daño a la integridad moral"" (callarse dónde está el cadáver) me parece la más endeble."|0
1619|A la cola por las autonómicas RT @pedroj_ramirez Ya era hora. El Gobierno cambiará la ley para facilitar privatización http://t.co/hJJGhf2Z|0
1620|Los políticos tienen difícil superar al alcalde de Getafe, protagonista de un vídeo de adelgazamiento http://t.co/nJQVSzpC|0
1621|Buscamos cobrador del Frac, para que Iker Casillas pague sus deudas a los compañeros. Gracias.|0
1622|Me parece muy injusto la sentencia del juicio de marta del castillo|0
1623|Indignante la sentencia y todos los acontecimientos en torno al caso #MartadelCastillo La justicia NO ES IGUAL para todos.#cadenaperpetuaYA|0
1624|Bdías. Estoy en Paris. La pérdida de la AAA de S&P cayó anoche como un jarro de agua fría sobre Francia. Sarko lo tiene mal en abril.|0
1625|"""No son maneras"", post sobre cómo se está comportando cara al público el Gobierno Rajoy, Soraya y los demás ministros. ..."|0
1626|Está claro que con Marta del Castillo no se ha hecho justicia. Ni se ha condenado a los culpables ni se ha dado... http://t.co/kWAkcOr2|0
1627|Denuncia la impunidad absoluta del pasado totalitario de España.|0
1628|Precisamente porque creo en la separación de poderes, me repugna el proceso inquisitorial al juez Garzón con inhabilitación preventiva.|0
1629|""" los socialistas han multiplicado por 5 la deuda publica en #Andalucia "" @javierarenas_pp #elcambioandaluz"|0
1630|Los turistas españoles del naufragio. El mal tiempo q llega. ¿Pq los casos d sarampión se han multiplicado x 10? Os lo contamos a las 3.|0
1631|Cuanto daño ha hecho el todo gratis d ZP. Pretenden metro gratis, luz gratis, casas gratis.Los países se suicidan, solo hay q mirar a Grecia|0
1632|Mis #trolldeldía de hoy (competición muy reñida). En el número uno, el resistente a la dictadura de ZP http://t.co/wUZTddEZ|0
1633|Recuperado otro cadáver en el Concordia,segun agencia Ansa.Ya son 6 muertos,entre ellos un español.Empresa armadora habla d error dl capitán|0
1634|Ya ya ...RT @UnaMujerDe40: No debería llamarte la atención @mariviromero. La hipocresía existe...|0
1635|Muy clarificador !La insostenible casta parasitaria española http://t.co/Zf4hB5pD via @DiarioSigloXXI|0
1636|"Ja ""principios de ultraismo y solidaridad q presiden el sistema nacional de trasplantes # #MédulaÓsea"|0
1637|Sólo el miedo a la derrota electoral  del @psoe puede explicar de los alcaldes del Parlamento Andaluz #elcambioandaluz|0
1638|SOS en el cuerno de África. Hambruna !|0
1639|Los abogados del turno de oficio abandonan por el recorte salarial http://t.co/NK5h5Y0L|0
1640|Como? esto que es? Los sindicatos tienen en plena crisis 9.000 tarjetas de crédito para pagar sus gastos http://t.co/GaJVqgoH|0
1641|Pero no luchaban por la cultura libre? 10 mill de euros! “@amanda_mars: Los fundadores de SeriesYonkis venden el portal http://t.co/TRrRdXq1|0
1642|Continúa el PP  pasando factura: primero con la cifra de déficit y hoy con un juicio simbólico a los políticos. JUICIO REAL  A  CORRUPTOS.|0
1643|RT @ostwitting: el pacto encubierto entre CiU-PP en Mataro ha sido bochornoso,PP despechado publica pacto en diario local #politica #mataro|0
1644|Corrijo....89 millones de toneladas de comida es lo que tiramos en Europa. Perdón.|0
1645|"#BastaYa : Un hombre mata a puñaladas a su ex mujer en Jaén y se entrega a la Guardia Civil"" http://t.co/hoKyVOyG via @elmundoes"|0
1646|Castellón: aeropuertos sin aviones, institutos sin calefacción y alumnos represaliados. Tremendo todo http://t.co/ivZsa0ok|0
1647|La Generalitat les debe a ls aytos catalanes 753 según el propio gobierno.“Catalunya ens roba”? No,simplemente deudas entre administraciones|0
1648|Está la cosita muy mala. Wolverine no es lo que era. http://t.co/WAlMsg0l|0
1649|@iescolar @laventana Si abogados de acusados en el caso Marta del Castillo autorizaron escuchas no hay equivalencia con Garzón|0
1650|Fijaos en la foto del angelito, conocido como Kim Schmitz, que se forraba con las descargas ilegales de Magaupload. http://t.co/MeONc3A7|0
1651|¡“@135sara: HAN ENCONTRADO UN TREN DEL 11M, ESCONDIDO POR FOMENTO.¡ TOMA YA !¿Y LOS Q FALTAN ? QUE LOS SAQUEN TODOS, via interec.”|0
1652|El fracaso de los fondos mineros está en la falta d voluntad del gobierno central y en nuestra incapacidad d diseñar su futuro en  Asturias|0
1653|Moisés Naín compara las desigualdades con el colesterol. Yo Discrepo y creo con Navarro que todas son malas para la justicia y la economía|0
1654|A vacas tan flacas, menos obsesión con el déficit. En mi blog en @20m http://t.co/RHPFCQfU|0
1655|B días! Camino de @anarosaq en Tele5. Accidente enorme en la carretera Fuencarral- Alcobendas.|0
1656|Org. Internacional dl Trabajo: si la desaceleración se materializa,los 200 millones d parados previstos para 2012 pueden subir a 204millones|0
1657|La tasa de desempleo más alta, 10,9%, se da en el norte de África y los más afectados son los jóvenes, según Org. Internacional del Trabajo|0
1658|Actualización: Al menos 10 muertos y 40 heridos por la explosión de 2 coches bomba en el barrio chií de Sadar City, Bagdad|0
1659|"Cospedal reitera desde el Senado ""el objetivo de déficit es irrenunciable"""|0
1660|La Junta oculta documentación sobre presunto pago de comisiones ilegales en el caso ERE http://t.co/4x8XxCRv|0
1661|Como servicio público deja mucho que desear. Según los ciudadanos es lenta, cara y poco comprensible.|0
1662|Que hacer si la recesión agrava las maltrechas cuentas publicas: seguir con el hacha como dice Rajoy o amoldarse a coyuntura como pide RbCb?|0
1663|Volviendo a la extorsión: Que la q se ejercía sobre los empresarios fuera mas grave que la de los comercios no hace q esta no lo sea 1/2|0
1664|Mal va un país cuando se pretend un neo lenguaje adecuado al 'nuevo tiempo. La extorsion es y será extorsion al margen de conveniencias 2/2|0
1665|En la lucha contra la corrupción nuevas figuras por despilfarro. Primero impulso a la fiscalía y utilizar las  figuras delictivas que ya hay|0
1666|"""¿Es gratis ir a los tribunales"", se mofaba Montoro de los que proponían el copago en la justicia http://t.co/ZMBOyXff"|0
1667|El cáncer de la corrupción y su consentimiento social   está más extendido aún de lo que pensábamos. Regeneración.|0
1668|Vaya gol anulado. Qué vergüenza!!|0
1669|Al menos 10 mueros en un atentado contra edificios policiales cerca de Bagdad, Irak|0
1670|Explosión gas posible causa dl derrumbe d 2 edificios Río d Janerio. Al menos 5 heridos y varios atrapados.Medios locales hablan d 2 muertos|0
1671|Dais ejemplos extremos, cuando  nuestra delincuencia grave en niños y adolescentes es mìnima. No se legisla para los casos concretos.|0
1672|Como en la Edad Media, el populismo penal provoca el miedo y luego lo conjura con penas extremas.|0
1673|"EL BARRIO en @HerreraenlaOnda : ""Cádiz es tierra de embajadores, están todos de baja"" Enorme el Barrio!!"|0
1674|vaya titular: Las interrupciones en adolescentes no crecieron con la ley http://t.co/5sKg0y9M Se trataba de que disminuyeran ,no?|0
1675|#elcambioandaluz @antoniosanz denuncia que la Consejera de Hacienda anuncia un 3%de deficit. Ayer @PepeGrinan dijo 1.4 % . Es tremendo|0
