|tweet|clase
2959|Miss u guys back. Viva Argentina. . ;) RT @vemariaramona: @AlejandroSanz , cuando venis a Argentina? We miss u!!!|1
2960|a ver esta peli de nuevo  (watching El Pianista) http://t.co/q0oqr870|1
2961|Muakkkkk RT @begochacon: @mariviromero el beso mas grande para ti por ser la tweetera mayor!!!!|1
2962|Me gusta: http://t.co/CSb5a414|1
2963|Hoy en #Torremolinos @eliasbendodo @javierarenas_pp @jmsoria presentan el #LibroBlancodeTurismo para #Andalucia|1
2964|"Rajoy a Rubalcaba ""tenemos una legislación laboral de hace 30 años y los tiempos han cambiado..la Reforma es buena, justa y necesaria"""|1
2965|Venga!!! CAfé para todos.RT @Rumbian1: @Buenafuente buenos dias. Un cafe? Esta recien hecho|1
2966|Imprescindible http://t.co/xrNQTHxC vía @guardian|1
2967|RT @MPedro_90: @Albert_Rivera por supuesto todas!Ya quisiera yo que #CLM fuera la que mas aportase al estado, eso sería una magnifica señal|1
2968|ja, ja!!!! @IsmaJuarez: @Buenafuente das el perfil para el anuncio de Kalise!!! @Rumbian1”|1
2969|EL PAÍS estrena portada. Nueva home. Aquí estamos.http://t.co/62i9JviF|1
2970|EL PAÍS estrena página web tras meses de transformaciones, también en la redacción. Puedes verla aquí http://t.co/Gj10eLcc|1
2971|Este video explica en detalle cómo moverse por la nueva web de EL PAÍS y explotar a fondo sus funcionalidades http://t.co/Ow7jownh|1
2972|El PP cambiará la Ley de Costas para legalizar las casas anteriores a 1988 http://t.co/OdaaJoHD|1
2973|"Insólito! El ministro de Exteriores, Margallo, hombre de ""extremo centro"", felicitado por su tono moderado por toda la oposición"|1
2974|Abrazos RT @ASanzQuotes: Pide a las estaciones de radio de tu pais que apoyen a #PositiveGeneration de ... http://t.co/dd3feBPR|1
2975|http://t.co/F2rzgDV2 ahi os lo dejo a ver is os gusta.|1
2976|@sanchez_sonia menos mal que has especificado!!!! ;-)|1
2977|Muy buenas noches followercetes! http://t.co/Edkg4j3p|1
2978|RT @_JAFET: OMG D: #MeVoy @paurubio Feat @EspinozaOficial Se encuentra en el Lugar 2 del Top Pop (cont) http://t.co/7ofT6bl2|1
2979|“@tttatitasanz: @David_Busta te suena CHILE Festival de viña? Quisiera verte por estos lares :)”Y YO QUIETO IR!!!|1
2980|2 turistas españoles rescatados en Colombia al encallar el velero en que viajaban.|1
2981|23F trabajando con normalidad en el Congreso, como debe ser. Nada que ver con el sarao de autobombo que organizó Bono el año pasado.|1
2982|@periodistas21 corregido. Abrazo.|1
2983|para los papas, por favor lean este articulo, vale la pena.http://t.co/LIRZK3gd|1
2984|Mañana en #losdesayunosdetve ampliamos el foco con Fiona Ortiz responsable de @Reuters en España y Mathieu de Taillac d @Le_Figaro|1
2985|Felicidad, poder compartir unas risas con tus ídolos... http://t.co/WK20RRZz|1
2986|. @PepeGrinan : la película - YouTube http://t.co/BYQjFd8X #GriñanLaPelicula Nominada a Los Oscars|1
2987|¡Lo mejor de mi timeline está disponible! http://t.co/0l0HzKDb ▸ Historias del día por @elpuertoac @jbello11 @paulasoto|1
2988|Que bien para ser el dia 1 ;-)) RT @victorggpp: @margadcm jartani, estoy en ello, no quepo....|1
2989|esa soy yooooooo jaaaa|1
2990|Incorporar el crowd en las organizaciones. Interesante articulo de @antonigr http://t.co/URzCCU6D|1
2991|#FF para #primaveravalenciana|1
2992|¡Noticias descombacantes! está disponible! http://t.co/pdWFYyRa|1
2993|Un abrazo para los compañeros de @Publico_es|1
2994|Menos mal que hay socialistas q hacen autocrítica y reconocen los meritos de otros:  - España http://t.co/xXMj912n vía @elconfidencial|1
2995|Krispin Klander oro cómico #personajesmiticos http://t.co/WFDD7gRD|1
2996|Os invito a participar en debate online sobre Proyecto de Ley contra el Dopaje en @ADI_elpv: http://t.co/5cH2NYy9 #Adidoping|1
2997|@PauladeLasHeras Gracias, aunq otros no piensan igual. Las tuyas suelen quedar mucho mejor. Besos|1
2998|Referencia Consejo Ministros: Aprobado el mecanismo de financiación a las entidades locales para el pago a proveedores  http://t.co/eeU5ln8s|1
2999|Os dejo unas fotitos. Muchos recuerdos de mi infancia en esta entrevista. http://t.co/j7CmNLPi|1
3000|“@AberronchoTV: @David_Busta te mando un saludo de cántabro a cántabro, un abrazo.”ABERRONCHOOOOOO!!! Abrazo!|1
3001|Empezamos @Gato_directo y hemos lamentado el cierre de #Publico. Enorme la intervención de @ajimenezgato q es necesario subrayar.|1
3002|¡Lo mejor de mi timeline está disponible! http://t.co/0l0HzKDb ▸ Historias del día por @luisfernandez @asv7777 @savetchildren|1
3003|Muy buenas noches followercetes http://t.co/JL1d0Lia|1
3004|Una belleza para estas horas!  Te la dedico si no puedes dormir!  Emeli Sande - Daddy - Acoustic Harmony: http://t.co/j9KWFTSY vía @youtube|1
3005|Ok...... Nacio un nuevo #Che!!! Estoy listo!|1
3006|¡Noticias descombacantes! está disponible! http://t.co/pdWFYyRa|1
3007|". @javierarenas_pp "" conmigo no habrá ni un solo euro que se gaste sin la firma de los funcionarios de la Junta de Andalucía """|1
3008|"Necesitamos todos tener nuestro ""drone""?.Agudo articulo de Fukuyama. http://t.co/Fn1o1zfF"|1
3009|Se van colocando las piezas del @PSOE tras Congreso Sevilla. Hoy, @cesarluena elegido Secretario General  PSOELaRioja.|1
3010|Feliz sabado a tod@s.. ;)|1
3011|Con el club de fans en Torrevieja http://t.co/aU8lcsaT|1
3012|“@martagg: @David_Busta tu rompes el mito que los artistas no se levantan antes de la 1 no?buenos días desde Ibiza” Me he caído de la cama!|1
3013|Me reclaman en la cocina. Esa es una llamada que nunca deberíais desatender.|1
3014|No os perdáis a javier Gimenez haciendo esta noche en @crackoviadeTV3 al gran P P Domingo Castaño d  @tjcope http://t.co/j5hbKFpF|1
3015|. @Juanma_Moreno y @Mjmorito ;-))  http://t.co/TOO4JB7O|1
3016|El próximo día siete de Marzo nos presentamos Izquierda Abierta en Madrid.|1
3017|La transparencia, confianza y credibilidad eran los objetivos de Montoro cuando convocó la rueda de prensa. Le ... http://t.co/ihC4Hwpv|1
3018|Beca para trabjar este verano en AP http://t.co/Cu02du85 #empleo #periodismo vía @saladeprensa|1
3019|Mañana voy al desayuno informativo de Barcina. Tengo la oportunidad de hacer una pregunta por escrito. ¿Cual harías tú?|1
3020|Buenos días.A las 9am asistiré al desayuno-coloquio con Zaryn Dentzel,creador de la red social Tuenti,para Primera plana d @elperiodico_cas|1
3021|"Hoy jornadas de trabajo ""Soluciones para prevenir crisis alimentarias"" organizadas por @oxfam_es con expertos de varios ámbitos."|1
3022|"Saliendo de @Servimedia, donde he sido sometida al ""tercer grado"" por @LuisMiguelBelda, Nino Olmeda y José Manuel González Huesa :-)"|1
3023|Desde la Sala Clara Campoamor del Senado qué menos que recomendar 'La revolución española vista por una republicana' http://t.co/g7aJEhk8|1
3024|"El líder del PSE de Álava, Txarli Prieto, ve ""razonable"" que se busquen ""vías de diálogo"" con la izquierda abertzale ""siempre, para avanzar"""|1
3025|El Estado Autonómico necesita adaptarse, buscar fórmulas eficaces para resolver los problemas sin duplicidades ni centralismo #28F|1
3026|Desde que se supo que la crisis era una realidad hemos hecho un esfuerzo constante para reducir gastos y recortar allí donde se podía. #CM|1
3027|Llegando a casa... Abrazo para todos!|1
3028|Me voy a dar un paseo x sevilla mientras @alikindoi_9 esta dando 3h seguidas de fisiologia! Jajaja animo bro!!|1
3029|Nos vemos en @TDtarde con @nievesherrero_ a partir de las 18:45 y con @susmoneo @JesusCintora @GOTZONEMORA Mari Pau y @lodares de invitado.|1
3030|Ofrenda floral a Blas Infante http://t.co/hswYlNHb @malaga|1
3031|Euríbor cerrará febrero x debajo del 1,7%. Bajan las hipotecas, continuando la tendencia de descenso que empezo en los últimos meses de 2011|1
3032|Alhaurín de la Torre y Málaga acogen el primer encuentro de festivales de jazz. http://t.co/FvQYz1dJ|1
3033|Compre la Mezquita de Córdoba es trending topic. Gracias. (va de este artículo en mi blog http://t.co/k0nkU7JO )|1
3034|La caída del Euribor rebaja las hipotecas por primera vez en año y medio http://t.co/7Pn0A9HQ|1
3035|RT @tomasdj: Como nuevo Defensor del Lector de EL PAÍS espero no desmerecer el legado de los muy admirados periodistas que me han precedido|1
3036|Jajajaja llevas razón!!! RT @JesusCintora: @FedericoQuevedo @Cepeda @varaca6 Y menos mal que salen a correr sino a ver quién los aguanta...|1
3037|El BCE PRESTA DINERO AL 1%. YO TAMBIÉN QUIERO! http://t.co/7lEc23ho|1
3038|Gracias a mis hermanos @Flofdez , @danimartinezweb ,|1
3039|siguiendo a @AyudaMalawi|1
3040|Fin de la jornada! De camino a casa! Deseando ver a mis chicas!;-)|1
3041|Pastor mantiene al equipo socialista en AENA y nombra a San José director de Comunicacion.|1
3042|Buenos días,hoy nos reunimos la Ministra y yo con el Consejo para la igualdad. Órgano q trabaja por evitar conductas xenófobas y excluyentes|1
3043|En el maracas de malaga! http://t.co/knQQVmUl|1
3044|Respondiendo a vuestras preguntas en @OndaCero_es !! http://t.co/inbHfICO|1
3045|Saludando a uno de los grupos que visita el Consolat de Mar en la jornada de puertas abiertas de hoy http://t.co/7LFaHXl9|1
3046|Fuencarral entrega en Sanidad 8.000 firmas contra el cierre de su centro de especialidades http://t.co/L3GL5bCo|1
3047|Amigos navarros: ¡Cinfa pretende producir Viagra! http://t.co/8bCfbks6|1
3048|RT @silcantalejos: @paurubio que lindo! Aca en Argentina, empezamos el otoño! :(|1
3049|Algo se va a aclarando el panorama. De Guindos confirma que mañana se aprobará el techo de gasto y el cuadro macro / vía EFE|1
3050|He publicado una foto nueva en Facebook http://t.co/HJaGQU4A|1
3051|Rueda de prensa en el espacio movistar de DF, presentación de la gira acústica en México. http://t.co/VqRGtxJE|1
3052|VALE YA ESTOY PREPARADA empieza en @antena3com  Dark Lage, Velita , luz apagada y ordenador n las piernas para retransmitir! o me acojon....|1
3053|"RT “@sgueina: ""los españoles sabemos cumplir con nuestro deber y en nuestro diccionario no está la palabra huir"" #55díasenPekín "|1
3054|La compañía de automóviles Mercedes-Benz quiere que sus coches ,Clase A, cuenten con Siri, el sistema de reconocimiento de voz de Apple (EP)|1
3055|La AVT mantiene su homenaje a las víctimas el 11 de marzo - http://t.co/vHs94xh4|1
3056|“@errauzkin: @David_Busta cuando vienes a Galiciaaa?”El Domingo! En A CORUÑA!;-)|1
3057|Torres-Dulce marca la pauta RT @la_informacion: El fiscal general  pide que se investigue uno de los trenes del 11M http://t.co/PiREWFzD|1
3058|http://t.co/QKuSDmGd” POLONIA D AYER. Primer gag, nuevo personaje : ARENAS!!;)|1
3059|Montoro y Guindos van a ser los encargados de presentar las previsiones económica del Gobierno tras el Consejo de Ministros|1
3060|"Esta tarde a las 20 h., en el Centro de Arte Moderno (Galileo 52, Madrid), presentamos el libro de Luisa Etxenike ""El detective de sonidos""."|1
3061|Un #FFal  @DrMartos que nos cuenta como ayudar a las empresas desde técnicas teatrales|1
3062|"De Guindos: ""este gobierno no va a generar nunca falsas expectativas"". Repite que el cuadro macro es ""realista"" #CMin"|1
3063|La encuesta del gobierno Mas da 3-4 diputados a C's. Hay que seguir trabajando para seguir creciendo.|1
3064|Hola! A todos mis twiteros!!! Viernes intrepido!!|1
3065|Gallardón cesa a Gª Castellón como juez enlace Francia. Lo adelanta @eva10diez en @OndaCero_es. El juez sopesa su su regreso a la Audiencia|1
3066|En el Hipódromo de Son Pardo entregando el XXVIII Gran Premi Govern Illes Balears http://t.co/yy05cjUr|1
3067|Aprobado también el Proyecto de Ley de Estabilidad Presupuestaria. Reforma estructural para no vivir situaciones como la que hemos vivido.|1
3068|Buenos días a todos!|1
3069|Dos titanes en chandal. “@LaVanguardia: Aparecen las primeras imágenes de Chávez en La Habana tras la operación http://t.co/JR6C2yvw”|1
3070|#sinescarmiento“@informativost5: Tomás Gómez,reelegido secretario gral d los socialistas madrileños por 59,22% d apoyos:http://t.co/wgFvfpKN|1
3071|Hola, buenas noches a todos. Esta es la portada de hoy, domingo, 4 de marzo http://t.co/sqmkhA1F|1
3072|RT: “@casastorcida: Son las 08.08 y a duras penas contengo la emoción. La Fiesta, Padilla y @ABCPuntoRadio, en directo. Cuento los segundos.|1
3073|16 estudiantes españoles salen ilesos del accidente de tren de Polonia - http://t.co/5y1xznCo|1
3074|Los colegios de la Palmilla organizan una muestra para no perder alumnos http://t.co/PFgnVAfa|1
3075|Y parece que al fin el AVE al que nos han trasladado a través de una pasarela desde el que se averió, se mueve...|1
3076|No es ningún consuelo, pero parece que en Alemania también hay habas para cocer. Otro dislate: http://t.co/R0beFu5m|1
3077|Vivir de lo que nadie quiere http://t.co/mrjKfHNI|1
3078|Y otra viuda que quiso abrazar al asesino y él se sorprendió sabiendo que no lo merecía... Aquí el videohttp://t.co/UGc2VcCB|1
3079|Hola!Con vuestro apoyo me estoy recuperando,superando etapas con paciencia y ánimo.Gracias de corazón,os sigo aunque aparezca poco,por ahora|1
3080|La política internacional no es un tablero descarnado  para imperialistas y anti, es un espacio donde hay pueblos y personas con derechos.|1
3081|"así es , dos días para la ""La Señal"" !!“@GLSaulo: Solo 2 dias para el esperado estreno del año ""#LaSeñal"" @juanes  #JuanesMTVUnplugged yeah."|1
3082|Luis de Guindos,mº d Economía,calcula q d haberse aplicado antes la reforma laboral aprobada x el Gob. habría un millón menos d desempleados|1
3083|Nuevo post en mi blog http://t.co/HPCiH1hh|1
3084|@SSantiagosegura mu raruno, amiguete...t lo digo yo q estuve estudiándolo y casi me da algo!!;) Spacey increible, verdad!! Con cuelgue y tó!|1
3085|Lunch time...;)))|1
3086|El secreto para que una dieta funcione es decir la verdad http://t.co/KYbcujuT via @elmundoes #chatidieta @mariarojo82|1
3087|No os perdáis la #portadaEPC de mañana: tema de apertura e imagen impagables. La tuiteo en un ratito.|1
3088|Muy buenas noches followercetes! http://t.co/RYgHXuLU|1
3089|Estoy con un Citadelle Reserve (el Rolls Royce de los gin tonics) a la salud de los miles que habéis mandado hoy tuits de todo tipo. Gcs.|1
3090|El fundador de Slashdot se pasa al WashPost RT @NiemanLab Why @cmdrtaco joined WaPo “Journalism is bigger than print” http://t.co/WQO0YHHX|1
3091|Muy buenos días followercetes!(yo me voy a dormir) http://t.co/KxzUBNfN|1
3092|Por cierto, sigo esperando conocer el plan del Gobierno para rentabilizar sus cuantiosos inmuebles inutilizados. No basta denunciar.|1
3093|«La Costa del Sol tiene una oferta renovada con todos los elementos para atraer al turista alemán».@eliasbendodo http://t.co/LJxbmyzc|1
3094|A punto de comenzar mi intervención en el Foro Joly. A partir de ahora os informa mi equipo|1
3095|El PP propone en el #Congreso que el Gobierno alcence acuerdos con las #RedesSociales para proteger a los menores.|1
3096|"No te pierdas ""Mitín Elías Bendodo, Javier Arenas y Mariano Rajoy"" a las El Viernes, 9 de marzo desde las 19:30... http://t.co/nTjH6BgG"|1
3097|Soraya Rodríguez dice q el PSOE participará en la manifestación convocada por los sindicatos el 11M|1
3098|#ElCambioAndaluz Arenas se compromete a modernizar y agilizar la Justicia  para adaptarla a las... http://t.co/k1mogtyW @javierarenas_pp|1
3099|Queremos que la banca contribuya a la creación de empleo, a la competitividad y al crecimiento económico http://t.co/pGxOsIeg|1
3100|Mañana propongo a los grupos y al gobierno que sean coherentes en sanidad y rechacen el REPAGO. Se  comprometieron en campaña electoral.|1
3101|Parece claro http://t.co/0KHiCtfn|1
3102|A ver chic@s: la frase de ir a Madrid y no gastar la he visto en informativo de la noche de Ant3. Y la he tuiteado porque me ha sorprendido|1
3103|Buenos días a todos!|1
3104|Somos parte de IU y queremos ser parte de un frente amplio de la izquierda política y social. Con apertura de ideas y organización.|1
3105|¡Noticias descombacantes! está disponible! http://t.co/pdWFYyRa|1
3106|A visitar Andiex . Empresa antequerana de venta al mayor de artículos de limpieza . 80 trabajadores [pic]: http://t.co/zsbo0U09|1
3107|Mas concede 3M a Centre d'estudis opinió(dept.Presidencia)para hacer encuestas sobre concierto econ e independentismo  #nacionalismoescrisis|1
3108|...Ayer el Real Madrid cumplió 110 años de leyenda y quería felicitaros por formar parte del mejor club del Mundo. #HalaMadrid|1
3109|Interesante artículo de Isaías Lafuente en el http://t.co/67xEZ0kY sobre la polémica del lenguaje sexista http://t.co/GVDm2Ifw|1
3110|Al teatro!! El COMPAC GRAN VIA nos espera...q mágico es Madrid!!!;)|1
3111|Estamos concluyendo acto PP con motivo Dia Internacional de la Mujer  http://t.co/xJuq5MYx|1
3112|Curioso RT @policia: ¿Os venís de #TweetPatrulla? Queremos celebrar el Día de la Mujer. 2 mujeres de la Policía tuitearán su trabajo|1
3113|No sé si será convincente pero le hemos preguntado hoy a Gallardón en una entrevista qué ha querido decir esta mañana. ...|1
3114|Buenos días mujeres trabajadoras! No os perdáis hoy (tod@os) la historia de Tara en #losdesayunosdetve ....|1
3115|“@sevillajordi: Hoy Día d la Mujer. Ni sus problemas d acceso en condiciones d igualdad son solo suyos, ni se resuelven a base d esperar.”|1
3116|Todo preparado!! @HerreraenlaOnda @OndaCero_es http://t.co/XwD03B5h|1
3117|El PSOE adelanta que va a pedir la comparecencia de Gallardón en la comisión de Justicia por el aborto|1
3118|El Día Internacional de la Mujer no es una fiesta, es para reivindicar y persistir. Igual naturaleza, igual derecho en todos los países.|1
3119|CiU apoya la reforma laboral del gobierno. Incluso Foro Asturias. El día en que el CIS da vendedor al PSOE ¿Habrá pacto PP/Foro? Creo que si|1
3120|Hemos aceptado la enmienda del PP y el PSOE a nuestra PNL sobre el IVA superreducido de los ebooks. Todos los grupos votaron a favor.  @UPyD|1
3121|Empezamos @TDtarde con @nievesherrero_ @JesusCintora Noelia Mnez, Paloma Zorrilla, Mediavilla y la presencia especial de Lucia Figar.|1
3122|Comienzo con mi gente una campaña en la que quiero ennoblecer la política con debates apasionados pero sinceros. http://t.co/1y5Svfbk|1
3123|Ay maÑica ojala pronto. RT @salaver7: @AlejandroSanz cuando vienes a zgz y aces un conciertico jajaaja|1
3124|yo :) “@montillavjavier: Me faltan 2 seguidores para 500. ¿Quién me ayuda?”|1
3125|@germanyanke nos vemos en Bucarest en la final? Hacemos la tertulia de RNE desde allí ?|1
3126|Esta es la luna que se ve desde mi ventana. Indiferente al diferencial d la deuda, apalancada de luz prestada. En paz. http://t.co/BaKSSN5l|1
3127|http://t.co/h0earSWv.     Ahi esta el regalito.|1
3128|Somos el reformismo del SUR y el #cambioandaluz que los andaluces ya votaron para sus ayuntamientos y el Gobierno de España. #votaPP #25M|1
3129|Empieza la campaña en Asturias y nuestro lema es:' podemos con ellos', y seguro que podemos frente al golpe de mercado y el bipartidismo.|1
3130|El cambio está en tus manos #elcambioandaluz http://t.co/2nuaFPXx|1
3131|Buenos días. A las 8:05 entraré en @Mati4Bandes_Rne , a las 8:15h en @maticatradio y a las 8:30 con @melchormiralles en @ABCPuntoRadio|1
3132|Of course! Hecho @FedericoQuevedo @joelareina|1
3133|Ya he visto el sol del Sur|1
3134|Por aquí están preparados para la nieve... http://t.co/1s8HOna5|1
3135|Y más: la semana según BVocal y el hallazgo de la temporada: inesperado consultorio eléctrico con Enrique  http://t.co/qbNC9FrY via @rtve|1
3136|He puesto 2 RT contrapuestos: nadie indiferente.|1
3137|RT @alfaro864: @paurubio Que le dijo un Globo a otro Globo... I glove you :)|1
3138|Hola a todos, hoy en Almería con @javierarenas_pp y @marianorajoy mitin en el pabellón Rafael Florido, podéis seguirlo  http://t.co/7sKpxHOH|1
3139|Convertiremos Bruselas en la novena provincia de las prioridades del #gobiernodelcambio para defender nuestra agricultura,ganadería y pesca|1
3140|@SSantiagosegura más|1
3141|Ay hija. Todo. RT @EsterCarLp: @AlejandroSanz pa'cuando concierto en Algeciras? recuerdas la playa del Rinconcillo?Que añoras de aquí?|1
3142|En Vélez Málaga, en diálogo con asociaciones culturales, asistenciales, agrarias, de vecinos... Una campaña de participación social.|1
3143|Ya estoy en Palma!!! |1
3144|Tras la intervención de @Luis_Verde , hoy anfitrión @jfgesp #elcambioandaluz http://t.co/Xf8Prf7B|1
3145|#11M #NoOlvidamos hasta mañana amig@s|1
3146|Buenos días desde Mallorca!vuelta a casa! http://t.co/by96CrqJ|1
3147|Rt@Lasdalton: Pilar Majon, no comparto sus soluciones y amistades, pero la respeto,perdió hace ocho años un hijo. La vida es difícil.|1
3148|Mañana 10:50h, fábrica zaragozana d Opel, asisto a la salida d la línea d montaje d la unidad número once millones d la Planta d Figueruelas|1
3149|La Sec.Prov. del PP en Cádiz @Tere_rsb ha ofrecido hoy un mitín en el Gastor. Gran trabajo el d la candidatura de Cádiz http://t.co/IehzRTQ0|1
3150|Pues no es por insistir, pero es que no me la quito de la cabeza... http://t.co/9BVXFNBl LoveDannyBoyle &amp; LoveAvenueOfHope. Good Night.|1
3151|Que descaséis. |1
3152|Apúntate a #ePeriódico: 2,99 euros por tres meses “@isaacaranjuez: Qué lástima q no llegue a Aranjuez. Enhorabuena por vuestra originalidad”|1
3153|Latinoamérica 2010-2020: La década recuperada. Por José Juan Ruiz. Banco Santander. http://t.co/MPaHJNUK|1
3154|Buenos días a todos!|1
3155|El 80% de españoles q estamos con la Constitución debemos plantarnos ante esas minorías (d uno y otro lado) q buscan imponerse con insultos.|1
3156|En la planta de #Opel en #Figueruelas sale de la línea de montaje la unidad número  once millones|1
3157|@javierarenas_pp #PROPONE: Reforma educativa y Pacto x la Educación para que sirva a varias generaciones. #votaPP|1
3158|A las 3 en @A3noticias, el gobierno se reafirma en la necesidad de la reforma laboral, después de las manifestaciones sindicales de ayer|1
3159|Esperando comienzo JD PP MADRID. Lleno de amigos twitteros http://t.co/pPIPqivH|1
3160|En la Junta Directiva @EsperanzaAguirre anuncia que volverá a presentarse como candidata para presidir el @PPMadrid en el próximo #Congreso|1
3161|"Juassssss! RT @ZairaAlonso: @mariviromero atencion al final del debate que habrá beso entre los ""y con lengua"""|1
3162|Obama is muslim es trending tópic mundial.... Cosassss http://t.co/ByqrV4no|1
3163|"gracias! Empezaba a pensar q me tenias manía o peor! Q no me ""ajuntabas"". Hahahaha ""@MonsieurSansFoy:  Lo tendrá su merced, pues lo merece.”"|1
3164|Hoy visitaremos la Nave Boetticher (Villaverde) para hablar sobre nuevas tecnologías en Madrid.|1
3165|le gusta This Is the Life de Amy Macdonald  en Ping http://t.co/o7ek2KpO #iTunes|1
3166|RT @balapiaka: Interesante: ¿Sabremos cambiar de era sin perder cohesión social ni calidad democrática?x @sevillajordi http://t.co/4EcZXSdn|1
3167|Cual es vuestro gag/sketch #martesy13  favorito?!?|1
3168|#martesy13 bicicletas sin sillín PN!!;) y la monja feliz!! Jajjajajja|1
3169|"""@FAN_JACKSON_: @ristomejide olaa que tal? Me sigues porfava?"" QuéFuerteTíaOseaNo."|1
3170|Hasta luego!!! Abrazoooooo!|1
3171|El PSOE tramita la presencia en el Congreso de sindicatos, CEOE y Cepyme ante la reforma laboral|1
3172|"Soraya Rodriguez  Psoe ""estaremos hombro con hombro con el Gobierno en la tarea de decirle a Bruselas así no podemos"""|1
3173|Hemos supervisado actuaciones de micropolítica demandadas desde hace mucho tiempo en la avenida del Greco #sevillahoy|1
3174|Jajaja RT@Kitosk: ¿Trabajas en Hogwarts? RT @AlejandroSanz: La magiaRT gaby_MASBSAS: AlejandroSanz QUE ES LO QUE AMAS DE TU TRABAJO?|1
3175|Entrega del #Premio #Carrefourhttp://t.co/Py1uFLIt http://t.co/sz0qWFM0|1
3176|Un abrazo padre de Anais. ;) RT @AnaisCardoso91: @AlejandroSanz Le puedes mandar un saludo a mi padre que ... http://t.co/pqeixKv3|1
3177|!Mi apoyo mas sincero¡ ANIMO. 7 jornada de huelga de los companeros de EL DIA y CNC http://t.co/Fj6Sp7W3 vía @eldigitalcastillalamancha|1
3178|Voy a ver si los de Iberia se enrollan y puedo coger un avión #festivaldeNantes|1
3179|Conclusión de Rajoy: coincidimos en la apuesta por la austeridad de la UE. Creemos que, aunque difíciles, son las políticas adecuadas|1
3180|El lunes 26, estreno de El Número Uno http://t.co/b2beAPbb vía @antena3com|1
3181|¡Noticias descombacantes! está disponible! http://t.co/GtjLld7K|1
3182|“@cata_pun: @Carlos_Latre Yo también quiero verte, ¿cuando vienes a Socuéllamos?” @SSantiagosegura  amiguete...vamos?!?;)|1
3183|;-)) RT @Emprenderioja: @mariviromero que sean dos! Cc/ @GanasdeVivir|1
3184|El Palacio de Congresos nos permitirá posicionarnos en calendario internacional del turismo de congresos,generar empleo de manera inmediata.|1
3185|The boss ;) RT @sintiendosanz: El locutor mas pekeño el sanzerito mas tierno de @RSanzOficial Jacobo @AlejandroSanz http://t.co/e3ia1wAP|1
3186|Caso me muero con @LosClones y su versión de #loewe en @Intereconomia . Aun me estoy muriendo de la risa!!! Clonnnnn eres lo massssssss|1
3187|¿Qué es la EDE?buena reflexión de Jordi Muixí http://t.co/8Z5i6ZqX|1
3188|Buenas noches guerrer@s. escojan bien sus batallas .. Hasta maÑana..|1
3189|Al huerto con una estrella Michelin #Malaga  http://t.co/JL5U6r38|1
3190|Preparo artículo sobre futuro de la lengua. Sabías q las telenovelas hispanas son uno de los grandes agentes difusión español en el mundo?|1
3191|Buenos dias amor &lt;3|1
3192|Buenas tardes twiteros!|1
3193|El Patronato orienta al mercado ruso el producto residencial 'Living #CostadelSol' http://t.co/nDC11FK9 @eliasbendodo|1
3194|Solucionaremos las necesidades que hay en Las Golondrinas y el colegio Pedro Garfia. Será un compromiso electoral cumplido en #sevillahoy|1
3195|Está a punto de comenzar el triunfo del Athletic. Momento histórico. Y yo de viaje...|1
